{
  "$schema": "http://json-schema.org/draft-07/schema#",
  "$id": "https://gsd.local/schemas/runtime-evidence/m016-s08-native-seven-agent-verify-protocol.v1.json",
  "title": "M016 S08 Native Seven Agent Verify Protocol v1",
  "description": "Independent verifier output. The verifier reads only the schemas/data module and the explicit admission/candidate/closure/scope paths, does NOT import the producer CLI, and emits the canonical M16-S08-VERIFY single-line verdict with exit code, blocker count, divisions count, correlated runs, unexpected mutation count and replay_key_match.",
  "type": "object",
  "additionalProperties": false,
  "required": [
    "schema_id",
    "schema_version",
    "protocol_id",
    "protocol_kind",
    "milestone",
    "slice",
    "task",
    "generated",
    "line_class",
    "canonical_protocol",
    "canonical_verdict_line",
    "verifier_exit_code",
    "closure_kind_observed",
    "closure_verdict_observed",
    "boundary_observed",
    "divisions_count",
    "correlated_runs",
    "unexpected_mutations",
    "replay_key_match",
    "tamper_classes_executed",
    "tamper_classes_passed",
    "tamper_classes_failed",
    "indemnity_groups",
    "verifier_imports",
    "producer_cli_imported",
    "network_calls",
    "mutation_count",
    "source_immutability_verified",
    "redaction_bounds_loaded",
    "sanitised",
    "raw_bodies_persisted",
    "blockers",
    "atomic_write"
  ],
  "properties": {
    "schema_id": {"const": "https://gsd.local/schemas/runtime-evidence/m016-s08-native-seven-agent-verify-protocol.v1.json"},
    "schema_version": {"const": "v1"},
    "protocol_id": {"type": "string", "pattern": "^(m016-s08-native-seven-agent-verify-protocol-v1|m016-s08-native-seven-agent-verify-protocol-v1-[a-z0-9._-]{1,32})$"},
    "protocol_kind": {"const": "native-seven-agent-integration-verify-protocol"},
    "milestone": {"const": "M016-txa3vu"},
    "slice": {"const": "S08"},
    "task": {"const": "T03"},
    "generated": {"type": "string", "pattern": "^\\d{4}-\\d{2}-\\d{2}T\\d{2}:\\d{2}:\\d{2}(?:\\.\\d{3})?Z$"},

    "line_class": {"const": "M16-S08-VERIFY"},
    "canonical_protocol": {"const": "PROTOCOL-M16-S08-VERIFY-V1"},
    "canonical_verdict_line": {"type": "string", "pattern": "^M16-S08-VERIFY verdict=(live:PROVEN_BOUNDED_NATIVE|scope_revised:NOT_PROVEN_SCOPE_REVISED) exit=[0-9] blockers=[0-9]+ divisions=[0-9]+ correlated_runs=[0-9]+ unexpected_mutations=[0-9]+ replay_key_match=(true|false)$"},

    "verifier_exit_code": {"type": "integer", "minimum": 0, "maximum": 9},

    "closure_kind_observed": {"enum": ["live", "scope_revised"]},
    "closure_verdict_observed": {"enum": ["PROVEN_BOUNDED_NATIVE", "NOT_PROVEN_SCOPE_REVISED"]},
    "boundary_observed": {"const": "PREPARATION_ONLY"},

    "divisions_count": {"type": "integer", "minimum": 0, "maximum": 7},
    "correlated_runs": {"type": "integer", "minimum": 0, "maximum": 7},
    "unexpected_mutations": {"type": "integer", "minimum": 0, "maximum": 64},
    "replay_key_match": {"type": "boolean"},

    "tamper_classes_executed": {"type": "integer", "minimum": 0, "maximum": 64},
    "tamper_classes_passed": {"type": "integer", "minimum": 0, "maximum": 64},
    "tamper_classes_failed": {"type": "integer", "minimum": 0, "maximum": 64},

    "indemnity_groups": {
      "type": "array",
      "minItems": 1,
      "maxItems": 16,
      "uniqueItems": true,
      "items": {"enum": ["admission", "identity", "correlation", "graph", "terminality", "provenance", "mutation", "timing", "redaction", "closure", "replay"]}
    },

    "verifier_imports": {
      "type": "array",
      "minItems": 1,
      "maxItems": 8,
      "uniqueItems": true,
      "items": {"type": "string", "pattern": "^(node:fs|node:path|node:crypto|node:test|node:assert/strict|scripts/lib/m016-s08-native-seven-agent-(data|contract)\\.js)$"}
    },
    "producer_cli_imported": {"const": false},

    "network_calls": {"const": 0},
    "mutation_count": {"const": 0},
    "source_immutability_verified": {"const": true},
    "redaction_bounds_loaded": {"const": true},

    "admission_ref": {"type": "string", "pattern": "^runtime-evidence/M016-S08-native-seven-agent-(admission|scope-decision)\\.json$"},
    "candidate_ref": {"type": "string", "pattern": "^runtime-evidence/M016-S08-native-seven-agent-candidate\\.json$"},
    "closure_ref": {"type": "string", "pattern": "^runtime-evidence/M016-S08-native-seven-agent-closure\\.json$"},
    "scope_decision_ref": {"type": "string", "pattern": "^runtime-evidence/M016-S08-native-seven-agent-scope-decision\\.json$"},
    "negative_fixtures_ref": {"type": "string", "pattern": "^runtime-evidence/M016-S08-native-seven-agent-negative-fixtures\\.json$"},

    "replay_keys": {
      "type": "object",
      "additionalProperties": false,
      "required": ["first_run_provenance_hash", "second_run_provenance_hash", "match", "byte_identical", "replay_key", "verified_at"],
      "properties": {
        "first_run_provenance_hash": {"type": "string", "pattern": "^[a-f0-9]{64}$"},
        "second_run_provenance_hash": {"type": "string", "pattern": "^[a-f0-9]{64}$"},
        "match": {"type": "boolean"},
        "byte_identical": {"type": "boolean"},
        "replay_key": {"type": "string", "pattern": "^[a-f0-9]{64}$"},
        "verified_at": {"type": "string", "pattern": "^\\d{4}-\\d{2}-\\d{2}T\\d{2}:\\d{2}:\\d{2}(?:\\.\\d{3})?Z$"}
      }
    },

    "source_refs": {
      "type": "array",
      "minItems": 5,
      "maxItems": 16,
      "uniqueItems": true,
      "items": {"type": "string", "pattern": "^runtime-evidence/M0(?:15|16)-(S0[0-9]|native)-[A-Za-z0-9._/-]+\\.json$"}
    },

    "sanitised": {"const": true},
    "raw_bodies_persisted": {"const": false},

    "blockers": {
      "type": "array",
      "maxItems": 96,
      "items": {
        "type": "object",
        "additionalProperties": false,
        "required": ["code", "reason"],
        "properties": {
          "code": {"type": "string", "pattern": "^M16-S08-VERIFY-[A-Za-z0-9._-]+$"},
          "reason": {"type": "string", "minLength": 1, "maxLength": 512}
        }
      }
    },

    "atomic_write": {
      "type": "object",
      "additionalProperties": false,
      "required": ["strategy", "verified"],
      "properties": {
        "strategy": {"const": "rename_temp_into_place"},
        "verified": {"const": true},
        "temp_relpath": {"type": "string", "pattern": "^runtime-evidence/M016-S08-native-seven-agent-verify-protocol\\.json\\.tmp-[a-z0-9._-]{1,32}$"},
        "final_relpath": {"type": "string", "pattern": "^runtime-evidence/M016-S08-native-seven-agent-verify-protocol\\.json$"}
      }
    }
  }
}