{
  "schema_id": "https://gsd.local/schemas/runtime-evidence/m016-s08-native-seven-agent-verify-protocol.v1.json",
  "schema_version": "v1",
  "protocol_id": "m016-s08-native-seven-agent-verify-protocol-v1",
  "protocol_kind": "native-seven-agent-integration-verify-protocol",
  "milestone": "M016-txa3vu",
  "slice": "S08",
  "task": "T03",
  "generated": "2026-07-28T04:06:16.000Z",
  "line_class": "M16-S08-VERIFY",
  "canonical_protocol": "PROTOCOL-M16-S08-VERIFY-V1",
  "canonical_verdict_line": "M16-S08-VERIFY verdict=scope_revised:NOT_PROVEN_SCOPE_REVISED exit=0 blockers=0 divisions=0 correlated_runs=0 unexpected_mutations=0 replay_key_match=false",
  "verifier_exit_code": 0,
  "closure_kind_observed": "scope_revised",
  "closure_verdict_observed": "NOT_PROVEN_SCOPE_REVISED",
  "boundary_observed": "PREPARATION_ONLY",
  "divisions_count": 0,
  "correlated_runs": 0,
  "unexpected_mutations": 0,
  "replay_key_match": false,
  "tamper_classes_executed": 14,
  "tamper_classes_passed": 14,
  "tamper_classes_failed": 0,
  "indemnity_groups": [
    "admission",
    "identity",
    "correlation",
    "graph",
    "terminality",
    "provenance",
    "mutation",
    "timing",
    "redaction",
    "closure",
    "replay"
  ],
  "verifier_imports": [
    "node:fs",
    "node:path",
    "node:crypto",
    "scripts/lib/m016-s08-native-seven-agent-data.js",
    "scripts/lib/m016-s08-native-seven-agent-contract.js"
  ],
  "producer_cli_imported": false,
  "network_calls": 0,
  "mutation_count": 0,
  "source_immutability_verified": true,
  "redaction_bounds_loaded": true,
  "admission_ref": "runtime-evidence/M016-S08-native-seven-agent-scope-decision.json",
  "scope_decision_ref": "runtime-evidence/M016-S08-native-seven-agent-scope-decision.json",
  "negative_fixtures_ref": "runtime-evidence/M016-S08-native-seven-agent-negative-fixtures.json",
  "replay_keys": {
    "first_run_provenance_hash": "474e9545b260c46c45e7071c486326faf2d8c33891c76c84b680f410af8ee51d",
    "second_run_provenance_hash": "474e9545b260c46c45e7071c486326faf2d8c33891c76c84b680f410af8ee51d",
    "match": false,
    "byte_identical": false,
    "replay_key": "2d25efc91d26c78865e588e7dae94fe444f4e450b8f648b3335246e5585922b7",
    "verified_at": "2026-07-20T12:00:00.000Z"
  },
  "source_refs": [
    "runtime-evidence/M015-S04-native-mission-contract.json",
    "runtime-evidence/M015-native-seven-division-mission-20260717.json",
    "runtime-evidence/M016-S05-seven-division-replay-admission.json",
    "runtime-evidence/M016-S05-seven-division-replay-probe-run.json",
    "runtime-evidence/M016-S05-seven-division-replay-verify-protocol.json"
  ],
  "sanitised": true,
  "raw_bodies_persisted": false,
  "blockers": [],
  "atomic_write": {
    "strategy": "rename_temp_into_place",
    "verified": true,
    "temp_relpath": "runtime-evidence/M016-S08-native-seven-agent-verify-protocol.json.tmp-m016-s08-verify-ms44vok0",
    "final_relpath": "runtime-evidence/M016-S08-native-seven-agent-verify-protocol.json"
  }
}
